{
  "$schema":"https://json-schema.org/draft/2020-12/schema",
  "$id":"https://ubuddy.invalid/schemas/cp-rir-contract-gate-v0.json",
  "type":"object","additionalProperties":false,
  "required":["$schema","schemaVersion","status","normativeRegistry","contractBefore","contractAfter","modelSet","actionLibrary","baseline","implementationStatus"],
  "properties":{
    "$schema":{"const":"ubuddy-cp-rir-contract-gate-v0.schema.json"},
    "schemaVersion":{"const":"cp-rir/contract-gate/v0"},
    "status":{"const":"illustrative_v0_draft"},
    "normativeRegistry":{"type":"object","additionalProperties":false,"required":["registryDigest","independentFromCandidate","lockedBeforeCandidate"],"properties":{"registryDigest":{"type":"string","pattern":"^[a-f0-9]{64}$"},"independentFromCandidate":{"type":"boolean"},"lockedBeforeCandidate":{"type":"boolean"}}},
    "contractBefore":{"$ref":"#/$defs/contract"},"contractAfter":{"$ref":"#/$defs/contract"},
    "modelSet":{"type":"object","additionalProperties":false,"required":["worldIds","preRegistered","candidateDependentFilter","closureDigest","preRegisteredAt","baselineId"],"properties":{"worldIds":{"type":"array","minItems":1,"items":{"type":"string","minLength":1},"uniqueItems":true},"preRegistered":{"type":"boolean"},"candidateDependentFilter":{"type":"boolean"},"closureDigest":{"type":"string","pattern":"^[a-f0-9]{64}$"},"preRegisteredAt":{"type":"string","minLength":1},"baselineId":{"type":"string","minLength":1}}},
    "actionLibrary":{"type":"array","minItems":1,"items":{"type":"object","additionalProperties":false,"required":["actionId","typed","cost","ownerId","effectClass"],"properties":{"actionId":{"type":"string","minLength":1},"typed":{"type":"boolean"},"cost":{"type":"number","exclusiveMinimum":0},"ownerId":{"type":"string","minLength":1},"effectClass":{"type":"string","minLength":1}}}},
    "baseline":{"type":"object","additionalProperties":false,"required":["baselineId","candidateIndependent","cost","nonTrivial","valueLowerBound"],"properties":{"baselineId":{"type":"string","minLength":1},"candidateIndependent":{"type":"boolean"},"cost":{"type":"number","exclusiveMinimum":0},"nonTrivial":{"type":"boolean"},"valueLowerBound":{"type":"number"}}},
    "implementationStatus":{"const":"planned/unverified"}
  },
  "$defs":{"obligation":{"type":"object","additionalProperties":false,"required":["id","kind","required","footprint","deadline","attemptLimit","freshness","idempotence","authorization"],"properties":{"id":{"type":"string","minLength":1},"kind":{"enum":["HARD","SOFT","EXCEPTION","MANUAL"]},"required":{"type":"boolean"},"footprint":{"type":"string","minLength":1},"deadline":{"type":"string","minLength":1},"attemptLimit":{"type":"integer","minimum":0},"freshness":{"type":"string","minLength":1},"idempotence":{"type":"string","minLength":1},"authorization":{"type":"string","minLength":1}}},"contract":{"type":"object","additionalProperties":false,"required":["scope","inputDomain","assumptions","obligations","footprint","observationProjection","exceptionPolicy","deadline","attemptLimit","freshness","idempotence","authorization","referenceEvaluator","costModel","contractDigest"],"properties":{"scope":{"type":"string","minLength":1},"inputDomain":{"type":"array","minItems":1,"items":{"type":"string","minLength":1}},"assumptions":{"type":"array","items":{"type":"string"}},"obligations":{"type":"array","minItems":1,"items":{"$ref":"#/$defs/obligation"}},"footprint":{"type":"string","minLength":1},"observationProjection":{"type":"string","minLength":1},"exceptionPolicy":{"type":"string","minLength":1},"deadline":{"type":"string","minLength":1},"attemptLimit":{"type":"integer","minimum":0},"freshness":{"type":"string","minLength":1},"idempotence":{"type":"string","minLength":1},"authorization":{"type":"string","minLength":1},"referenceEvaluator":{"type":"string","minLength":1},"costModel":{"type":"string","minLength":1},"contractDigest":{"type":"string","pattern":"^[a-f0-9]{64}$"}}}}
}
