{
  "$schema":"ubuddy-cp-rir-contract-gate-v0.schema.json","schemaVersion":"cp-rir/contract-gate/v0","status":"illustrative_v0_draft","normativeRegistry":{"registryDigest":"eeeeeeeeeeeeeeeeeeeeeeeeeeeeeeeeeeeeeeeeeeeeeeeeeeeeeeeeeeeeeeee","independentFromCandidate":true,"lockedBeforeCandidate":true},
  "contractBefore":{"scope":"cross-owner-workflow","inputDomain":["request","owner-attestation"],"assumptions":["finite-horizon"],"obligations":[{"id":"o1","kind":"HARD","required":true,"footprint":"s1:s2","deadline":"tick<=5","attemptLimit":2,"freshness":"epoch-bound","idempotence":"keyed","authorization":"owner-attested"},{"id":"o2","kind":"HARD","required":true,"footprint":"s2","deadline":"tick<=5","attemptLimit":2,"freshness":"epoch-bound","idempotence":"keyed","authorization":"owner-attested"}],"footprint":"s1,s2","observationProjection":"public-cut-v0","exceptionPolicy":"abstain-only","deadline":"tick<=5","attemptLimit":2,"freshness":"epoch-bound","idempotence":"keyed","authorization":"owner-attested","referenceEvaluator":"locked-u-v0","costModel":"positive-additive-v0","contractDigest":"aaaaaaaaaaaaaaaaaaaaaaaaaaaaaaaaaaaaaaaaaaaaaaaaaaaaaaaaaaaaaaaa"},
  "contractAfter":{"scope":"cross-owner-workflow","inputDomain":["request","owner-attestation"],"assumptions":["finite-horizon"],"obligations":[{"id":"o1","kind":"HARD","required":true,"footprint":"s1:s2","deadline":"tick<=5","attemptLimit":2,"freshness":"epoch-bound","idempotence":"keyed","authorization":"owner-attested"},{"id":"o2","kind":"HARD","required":true,"footprint":"s2","deadline":"tick<=5","attemptLimit":2,"freshness":"epoch-bound","idempotence":"keyed","authorization":"owner-attested"}],"footprint":"s1,s2","observationProjection":"public-cut-v0","exceptionPolicy":"abstain-only","deadline":"tick<=5","attemptLimit":2,"freshness":"epoch-bound","idempotence":"keyed","authorization":"owner-attested","referenceEvaluator":"locked-u-v0","costModel":"positive-additive-v0","contractDigest":"bbbbbbbbbbbbbbbbbbbbbbbbbbbbbbbbbbbbbbbbbbbbbbbbbbbbbbbbbbbbbbbb"},
  "modelSet":{"worldIds":["w-hard-upstream","w-hard-cache"],"preRegistered":true,"candidateDependentFilter":false,"closureDigest":"cccccccccccccccccccccccccccccccccccccccccccccccccccccccccccccccc","preRegisteredAt":"2026-09-01T00:00:00Z","baselineId":"noop-positive-v0"},
  "actionLibrary":[{"actionId":"probe-owner","typed":true,"cost":1,"ownerId":"owner-a","effectClass":"READ_ONLY"},{"actionId":"bind-version","typed":true,"cost":2,"ownerId":"owner-b","effectClass":"VERSION_BIND"}],
  "baseline":{"baselineId":"noop-positive-v0","candidateIndependent":true,"cost":1,"nonTrivial":true,"valueLowerBound":0.1},
  "implementationStatus":"planned/unverified"
}
